{"$id":"https://schemas.yeisme.dev/auctra/graph-kit/v2","$schema":"https://json-schema.org/draft/2020-12/schema","additionalProperties":false,"properties":{"api_version":{"const":"auctra.graph_kit.v2"},"compatibility":{"type":"string"},"id":{"pattern":"^[a-z0-9][a-z0-9._-]*\\.v[0-9]+$","type":"string"},"lens_refs":{"items":{"type":"string"},"minItems":1,"type":"array"},"maturity":{"enum":["experimental","first-support"]},"panels":{"maxItems":10,"minItems":10,"type":"array"},"source_adapter_refs":{"items":{"type":"string"},"type":"array"},"title":{"minLength":1,"type":"string"},"validator_refs":{"items":{"type":"string"},"type":"array"},"view_refs":{"items":{"type":"string"},"minItems":1,"type":"array"}},"required":["api_version","id","title","lens_refs","view_refs","panels","compatibility","maturity"],"title":"Auctra Graph Kit v2","type":"object"}